<?xml version="1.0" ?>

<!-- $Header: $ -->

<!-- mini test CAL ped  XML file according to calCalib.dtd -->

<!DOCTYPE calCalib SYSTEM "../calCalib_v1.dtd" [] >

<calCalib>
  <generic instrument="LAT" timestamp="2002-11-2-12:56" 
           calibType="CAL_Ped" fmtVersion="v1r0">

    <inputSample startTime="2002-1-1-00:00" stopTime="2002-6-1-00:00" 
                 triggers="random" mode="normal" source="stuff" >
     There is no input sample in fact.
     Everything is just made up for code testing.
     Note the entire inputSample element is optional.  It could
     be omitted altogether.
    </inputSample>
  </generic>


<!-- The dimensions here correspond to no real instrument, of course.
     I made them small for purposes of illustration.  With these
     dimensions, the total number of calPed elements to follow should
     be 1*1*2*4*2*4 = 64,  but I haven't included them all.
  -->
 
  <dimension nRow="1" nCol="1" nLayer="2" nXtal="4" nFace="2" />  

  <!-- Data for layer 0, xtal 0, face 0 -->
  <calPed avg="8" sig="0.4" />
  <calPed avg="8" sig="0.3" />
  <calPed avg="6" sig="0.4" />
  <calPed avg="7" sig="0.4" />
  
  <!-- Data for layer 0, xtal 0, face 1 -->
  <calPed avg="7" sig="0.6" />
  <calPed avg="8" sig="0.3" />
  <calPed avg="6" sig="0.7" />
  <calPed avg="7" sig="0.4" />

  <!-- Data for layer 0, xtal 1 -->
  <calPed avg="8" sig="0.4" />  
  <calPed avg="8" sig="0.4" />  
  <calPed avg="8" sig="0.4" />  
  <calPed avg="8" sig="0.4" />  
  <calPed avg="8" sig="0.4" />  
  <calPed avg="8" sig="0.4" />  
  <calPed avg="8" sig="0.4" />  
  <calPed avg="8" sig="0.4" />

<!-- A legitimate file consistent with the values in the dimension element
     above would have 8 more calPed elements following each of the 
     comment lines below -->
  <!-- Data for layer 0, xtal 2 -->

  <!-- Data for layer 0, xtal 3 -->


  <!-- Data for layer 1, xtal 0 -->

  <!-- Data for layer 1, xtal 1 -->

  <!-- Data for layer 1, xtal 2 -->

  <!-- Data for layer 1, xtal 3 -->

</calCalib>











